{
  "$schema": "./criteria.schema.json",
  "version": "0.1.0",
  "updated": "2026-06-29",
  "description": "Reusable, source-backed audit criteria for scoring media-buyer decisions. Each criterion is a single checkable rule drawn from an authoritative PPC/paid-social source. Attach criteria to a case by id (see rubrics/README.md). Thresholds are DEFAULTS and are tunable per case; do not treat them as laws.",
  "type_legend": {
    "programmatic": "Objective check computable from account/case data (no LLM needed).",
    "judge": "Subjective call that requires an LLM-judge or human rubric.",
    "hybrid": "Programmatic trigger, judged severity/relevance."
  },
  "authority_legend": {
    "official": "Published by the ad platform itself (Google/Meta/X docs).",
    "expert": "Published by a recognized practitioner/tool (Adalysis, Optmyzr, Brad Geddes, WordStream, named PPC authorities).",
    "convention": "Widely used industry number with no authoritative published cutoff. Treat as tunable and lower-confidence."
  },
  "principles": [
    "Score decision quality given the data, not realized outcomes. There is no outcome ground truth in paid media.",
    "Never use an aggregate score (Google Optimization Score, WordStream grade) as ground truth: both reward suggestion-adoption, not ROI. Use the individual underlying checks instead.",
    "Senior judgment beats checkbox-following. Some 'best practice' checks have evidence-backed exceptions (e.g. Ad Strength); these are tagged with a caution.",
    "Thresholds are defaults. Prefer band-based scoring over hard pass/fail on borderline metrics."
  ],
  "criteria": [
    {
      "id": "g.struct.no_active_ads",
      "provider": "google_ads",
      "category": "account_structure",
      "title": "Ad group has no active ads",
      "type": "programmatic",
      "authority": "expert",
      "condition": "Ad group with 0 enabled ads.",
      "default_threshold": {"active_ads_min": 1},
      "window_days": null,
      "tunable": false,
      "source": {"name": "Adalysis prebuilt alerts", "url": "https://docs.adalysis.com/tools/audit/prebuilt-alert-list/"}
    },
    {
      "id": "g.struct.single_ad_no_test",
      "provider": "google_ads",
      "category": "account_structure",
      "title": "Ad group running a single ad (no test in flight)",
      "type": "programmatic",
      "authority": "expert",
      "condition": "Ad group with exactly 1 enabled ad, so no A/B test is possible.",
      "default_threshold": {"active_ads_min_for_test": 2},
      "window_days": null,
      "tunable": false,
      "source": {"name": "Brad Geddes / Adalysis (always-be-testing)", "url": "https://bgtheory.com/blog/the-complete-adwords-audit-part-10-testing/"}
    },
    {
      "id": "g.struct.too_many_ads",
      "provider": "google_ads",
      "category": "account_structure",
      "title": "Too many ads per ad group (test dilution)",
      "type": "programmatic",
      "authority": "expert",
      "condition": "Ad group with more than the recommended number of enabled ads, slowing time-to-significance.",
      "default_threshold": {"active_ads_max": 3},
      "window_days": null,
      "tunable": true,
      "notes": "Adalysis recommends max 3; for high-volume groups 2-4 is acceptable.",
      "source": {"name": "Adalysis", "url": "https://docs.adalysis.com/tools/audit/prebuilt-alert-list/"}
    },
    {
      "id": "g.struct.too_many_keywords",
      "provider": "google_ads",
      "category": "account_structure",
      "title": "Too many keywords per ad group (loose theming)",
      "type": "programmatic",
      "authority": "expert",
      "condition": "Ad group with more keywords than its theme can support, hurting ad relevance.",
      "default_threshold": {"keywords_max": 20},
      "window_days": null,
      "tunable": true,
      "notes": "Threshold varies by source: Adalysis flags >50; WordStream ~20; SEJ recommends <=10. Set per case.",
      "source": {"name": "Adalysis / WordStream / SEJ", "url": "https://www.searchenginejournal.com/google-ads-audit/361156/"}
    },
    {
      "id": "g.struct.no_rsa",
      "provider": "google_ads",
      "category": "account_structure",
      "title": "Ad group has no responsive search ad",
      "type": "programmatic",
      "authority": "official",
      "condition": "Ad group with 0 RSAs. Google requires at least 1 RSA per ad group (best practice: 2 at Good/Excellent strength).",
      "default_threshold": {"rsa_min": 1},
      "window_days": null,
      "tunable": false,
      "source": {"name": "Google Ads Help — Responsive search ads", "url": "https://support.google.com/google-ads/answer/7684791"}
    },
    {
      "id": "g.struct.search_with_display",
      "provider": "google_ads",
      "category": "account_structure",
      "title": "Search campaign opted into Display network",
      "type": "programmatic",
      "authority": "expert",
      "condition": "Search campaign with 'Search with Display Select' enabled, mixing two channels under one budget/strategy.",
      "default_threshold": {"display_on_search_campaign": false},
      "window_days": null,
      "tunable": false,
      "source": {"name": "Adalysis", "url": "https://docs.adalysis.com/tools/audit/prebuilt-alert-list/"}
    },
    {
      "id": "g.struct.autoapply_enabled",
      "provider": "google_ads",
      "category": "account_structure",
      "title": "Auto-apply recommendations enabled (risk)",
      "type": "programmatic",
      "authority": "expert",
      "condition": "Account has auto-apply recommendations turned on, allowing unreviewed structural changes.",
      "default_threshold": {"auto_apply_enabled": false},
      "window_days": null,
      "tunable": false,
      "source": {"name": "Adalysis / Optmyzr", "url": "https://www.optmyzr.com/guide/ppc-audit/"}
    },
    {
      "id": "g.struct.themed_keyword_count",
      "provider": "google_ads",
      "category": "account_structure",
      "title": "Keep themed ad groups to 5-15 keywords",
      "type": "hybrid",
      "authority": "expert",
      "condition": "Tightly themed ad groups (5-15 closely related keywords) improve ad relevance; flag groups far outside this band for review.",
      "default_threshold": {"keywords_min": 5, "keywords_max": 15},
      "window_days": null,
      "tunable": true,
      "judge_guidance": "Counting is programmatic; whether the keywords are genuinely thematically coherent is a judged call.",
      "source": {"name": "Adalysis / Google ad relevance guidance", "url": "https://support.google.com/google-ads/answer/6167130"}
    },
    {
      "id": "g.kw.zero_conversion_waste",
      "provider": "google_ads",
      "category": "wasted_spend",
      "title": "Keyword spending with no conversions",
      "type": "programmatic",
      "authority": "expert",
      "condition": "Keyword with 0 conversions and significant click volume over the window.",
      "default_threshold": {"conversions_max": 0, "clicks_min": 150},
      "window_days": 30,
      "tunable": true,
      "source": {"name": "Adalysis — keywords with poor conversions", "url": "https://docs.adalysis.com/tools/audit/prebuilt-alert-list/"}
    },
    {
      "id": "g.kw.expensive_conversions",
      "provider": "google_ads",
      "category": "wasted_spend",
      "title": "Keyword generating expensive conversions",
      "type": "programmatic",
      "authority": "expert",
      "condition": "Keyword whose CPA is far above the ad group average.",
      "default_threshold": {"cpa_multiple_of_adgroup_avg": 2.0},
      "window_days": 30,
      "tunable": true,
      "source": {"name": "Adalysis — expensive conversions", "url": "https://docs.adalysis.com/tools/audit/prebuilt-alert-list/"}
    },
    {
      "id": "g.kw.duplicate_keywords",
      "provider": "google_ads",
      "category": "keyword_hygiene",
      "title": "Duplicate keywords within a campaign",
      "type": "programmatic",
      "authority": "expert",
      "condition": "Same keyword/match-type appears more than once in a campaign, causing self-competition.",
      "default_threshold": {"duplicates_max": 0},
      "window_days": null,
      "tunable": false,
      "source": {"name": "Adalysis", "url": "https://docs.adalysis.com/tools/audit/prebuilt-alert-list/"}
    },
    {
      "id": "g.kw.keyword_negative_conflict",
      "provider": "google_ads",
      "category": "keyword_hygiene",
      "title": "Keyword blocked by a negative keyword",
      "type": "programmatic",
      "authority": "expert",
      "condition": "An active keyword is suppressed by a conflicting negative keyword.",
      "default_threshold": {"conflicts_max": 0},
      "window_days": null,
      "tunable": false,
      "source": {"name": "Adalysis", "url": "https://docs.adalysis.com/tools/audit/prebuilt-alert-list/"}
    },
    {
      "id": "g.kw.long_tail_usage",
      "provider": "google_ads",
      "category": "keyword_hygiene",
      "title": "Long-tail keyword usage",
      "type": "programmatic",
      "authority": "expert",
      "condition": "Share of keywords that are long-tail (>=3 tokens), which tend to be higher-intent and cheaper.",
      "default_threshold": {"long_tail_min_tokens": 3},
      "window_days": null,
      "tunable": true,
      "source": {"name": "WordStream — long-tail keywords", "url": "https://www.wordstream.com/long-tail-keywords"}
    },
    {
      "id": "g.st.review_cadence_weekly",
      "provider": "google_ads",
      "category": "keyword_hygiene",
      "title": "Search terms reviewed weekly (esp. broad match)",
      "type": "programmatic",
      "authority": "expert",
      "condition": "Search-term report should be reviewed at least weekly; flag accounts with no recent search-term review.",
      "default_threshold": {"max_days_since_review": 7},
      "window_days": 7,
      "tunable": true,